在《金色梦乡》中，青柳雅春认为面对困难时人最强大的武器是什么？|笑。不管问题多困难，情况多悲惨，只要还能笑一笑，就会有重新充电的感觉。|伊坂幸太郎|金色梦乡（同名电影原著）|https://weread.qq.com/web/bookDetail/849134|◆ [第四部 事件] 森田啊，依我看，人最强大的武器不应该是笑吗？他真想这样告诉森田森吾。不管问题多困难，情况多悲惨，只要还能笑，当然很多时候或许根本笑不出来，但只要能笑一笑，就会有重新充电的感觉。这是事实。|金色梦乡::第四部
青柳雅春的父亲在记者围堵时提出了什么赌约？|要求记者用自己人生中重要的东西来赌儿子是否为凶手。|伊坂幸太郎|金色梦乡（同名电影原著）|https://weread.qq.com/web/bookDetail/849134|◆ [第四部 事件] 吵死了，青柳雅春的父亲挥了挥右手，好像是在驱赶苍蝇。"好，我就跟你们打赌！你们敢不敢？我儿子到底是不是凶手，你们敢不敢跟我打赌？"他一个个地指着将自己围在当中的记者，"你们一副大义凛然的模样，却连名字都不敢报上来。你们要真相信青柳雅春是凶手，就跟我打赌。不赌钱，就赌你们人生中重要的东西。这不就是你们现在打算做的事吗？玩着众口铄金的花招，把我们的生活摧毁。你们给我听好了，我承认这是你们的工作，工作没办法回避。但是，一旦自己的工作有可能破坏他人的生活，你就得有相应的心理准备。公交车司机也好，建筑设计师也好，厨师也好，大家都对自己的行为小心翼翼，为什么呢？因为他们做的事关系到他人的生活，就要有这个心理准备。"|金色梦乡::第四部
青柳雅春父亲用什么职业类比来批评记者缺乏职业责任感？|公交车司机、建筑设计师、厨师——他们都对自己的行为小心翼翼，因为工作关系到他人的生活，而记者用众口铄金摧毁他人生活却缺乏同样的心理准备。|伊坂幸太郎|金色梦乡（同名电影原著）|https://weread.qq.com/web/bookDetail/849134|◆ [第四部 事件] 吵死了，青柳雅春的父亲挥了挥右手，好像是在驱赶苍蝇。"好，我就跟你们打赌！你们敢不敢？我儿子到底是不是凶手，你们敢不敢跟我打赌？"他一个个地指着将自己围在当中的记者，"你们一副大义凛然的模样，却连名字都不敢报上来。你们要真相信青柳雅春是凶手，就跟我打赌。不赌钱，就赌你们人生中重要的东西。这不就是你们现在打算做的事吗？玩着众口铄金的花招，把我们的生活摧毁。你们给我听好了，我承认这是你们的工作，工作没办法回避。但是，一旦自己的工作有可能破坏他人的生活，你就得有相应的心理准备。公交车司机也好，建筑设计师也好，厨师也好，大家都对自己的行为小心翼翼，为什么呢？因为他们做的事关系到他人的生活，就要有这个心理准备。"|金色梦乡::第四部
"众口铄金"在《金色梦乡》中指的是什么行为？|记者们利用舆论引导公众相信青柳雅春是凶手，以此摧毁他和家人的生活。|伊坂幸太郎|金色梦乡（同名电影原著）|https://weread.qq.com/web/bookDetail/849134|◆ [第四部 事件] 吵死了，青柳雅春的父亲挥了挥右手，好像是在驱赶苍蝇。"好，我就跟你们打赌！你们敢不敢？我儿子到底是不是凶手，你们敢不敢跟我打赌？"他一个个地指着将自己围在当中的记者，"你们一副大义凛然的模样，却连名字都不敢报上来。你们要真相信青柳雅春是凶手，就跟我打赌。不赌钱，就赌你们人生中重要的东西。这不就是你们现在打算做的事吗？玩着众口铄金的花招，把我们的生活摧毁。你们给我听好了，我承认这是你们的工作，工作没办法回避。但是，一旦自己的工作有可能破坏他人的生活，你就得有相应的心理准备。公交车司机也好，建筑设计师也好，厨师也好，大家都对自己的行为小心翼翼，为什么呢？因为他们做的事关系到他人的生活，就要有这个心理准备。"|金色梦乡::第四部
青柳雅春写下"我不是凶手"后，纸上出现了哪几个字给了他力量？|出现了笔迹不同的"我知道。"三个字，简洁而有力地表达了信任和支持。|伊坂幸太郎|金色梦乡（同名电影原著）|https://weread.qq.com/web/bookDetail/849134|◆ [第四部 事件] "我不是凶手。青柳雅春"—自己写下的字还在纸上。那歪歪的字迹他再熟悉不过。但是在那些字的旁边，多出了几个比青柳雅春的笔迹要淡一些、但却十分工整的字：\n"我知道。"|金色梦乡::第四部
"也不一定没用"这个二重否定在《金色梦乡》中表达了什么样的肯定？|表达一种谨慎而不确定的肯定——"可能有用，但不敢保证"。|伊坂幸太郎|金色梦乡（同名电影原著）|https://weread.qq.com/web/bookDetail/849134|◆ [第四部 事件] "也不一定没用？"这复杂的二重否定让青柳雅春头晕。|金色梦乡::第四部
青柳雅春逃命时找车遇到了什么反差？|电影中常见的"没锁的车插着钥匙""遮阳板下有备用钥匙"的好事都没发生，他只能关上车门继续跑。|伊坂幸太郎|金色梦乡（同名电影原著）|https://weread.qq.com/web/bookDetail/849134|◆ [第四部 事件] 他找到一辆没上锁的车，打开了驾驶座一侧的车门。伸手在方向盘旁边一摸，钥匙还插着—当然不会有那种好事；遮阳板和手套箱内一找，结果发现了钥匙—这种好事也没碰上。关上车门，再跑。|金色梦乡::第四部
读者重读《金色梦乡》后的整体感受是什么？|酣畅淋漓的阅读体验，长久记忆中只留下愉悦感，重读时感叹"听着来自森林的声音，这真摇滚！"|伊坂幸太郎|金色梦乡（同名电影原著）|https://weread.qq.com/web/bookDetail/849134|◆ 💭 大约十年前在微信读书上看过电子版，前阵子在少儿图书馆意外廖到这本书，想借来给孩子看，结果自己「不小心」又再看了一遍。不长记性的我已经全然忘记当初阅读时书中的内容细节，但隐隐只是觉得是一场酣畅淋漓的阅读体验，重读之下，「听着来自森林的声音，这真摇滚！」|金色梦乡
读者对《金色梦乡》的长期印象可用哪两句话概括？|"念念不忘，必有回响"——即使忘记细节，阅读的美好感受仍存留。|伊坂幸太郎|金色梦乡（同名电影原著）|https://weread.qq.com/web/bookDetail/849134|◆ 💭 念念不忘，必有回响。|金色梦乡
《金色梦乡》中"笑"作为武器，与《三体》中三体人的设定有何关联联想？|三体人无法说谎，而人类不仅会说谎，甚至可以用笑来欺骗自己或他人——这是一种只有人类才有的复杂能力。|伊坂幸太郎|金色梦乡（同名电影原著）|https://weread.qq.com/web/bookDetail/849134|◆ 💭 突然想起三体里面无法说谎的三体人，作为人类欺骗也是一门学问。欺骗不仅可以是对他人的，也可以是对自己的。（对应划线：森田啊，依我看，人最强大的武器不应该是笑吗？他真想这样告诉森...）|金色梦乡
青柳雅春父亲反驳记者的话体现了怎样的说话特点？|用最朴素的话揭示深刻的道理，看似简单的人往往有这不简单的一面。|伊坂幸太郎|金色梦乡（同名电影原著）|https://weread.qq.com/web/bookDetail/849134|◆ 💭 用最朴素的话揭示深刻的道理，这是某些看似简单的人所不简单的地方。（对应划线：吵死了，青柳雅春的父亲挥了挥右手，好像是在驱赶苍蝇。"好，我...）|金色梦乡
读者对"二重否定"句式有什么习惯性反应？|碰到多重否定经常要迟疑一会才能想通。|伊坂幸太郎|金色梦乡（同名电影原著）|https://weread.qq.com/web/bookDetail/849134|◆ 💭 最近碰到多重否定经常要迟疑一会才想通。（对应划线："也不一定没用？"这复杂的二重否定让青柳雅春头晕。...）|金色梦乡
读者对青柳雅春找车情节的反应是什么？|笑了。失败的好莱坞式找车桥段让人会心一笑。|伊坂幸太郎|金色梦乡（同名电影原著）|https://weread.qq.com/web/bookDetail/849134|◆ 💭 笑了（对应划线：他找到一辆没上锁的车，打开了驾驶座一侧的车门。伸手在方向盘旁...）|金色梦乡
